SOP Name,Source URL,Content
Split Shipment,https://sites.google.com/shiprocket.com/sop-shiprocket/split-shipment,"Definition :- Split Shipment allows the sellers the ship partial shipments as per available stock. Opening : Good Morning/Afternoon/Evening Welcome to shiprocket. My Name is _. How may I help you? System Check :- 1) Copy link from SPARK & paste it in new tab Inform seller about :- I would like to inform you that by enabling split shipment in your account, you will be able to Fulfill Orders partially based on the SKU's availability in your warehouse also p rovide faster deliveries to your customers by reducing order processing time & s hip different products from different warehouses . This allows you to create 2 shipments with same Mother AWB number, and each of them will be having a Chile AWB number. Path to enable Split shipment: 1) Log in to your panel >>Settings>> Shipment Feature>> Split Shipment. 2) Turn the toggle on to activate ""split shipment"" for your account. Note: Split Shipment functionality only works for manual order creation. Steps to create split shipment order : Go to the ""Add Order"" screen and create your order manually. Once order is created the same will be visible in ""Processing"" tab Now, select your order from ""Processing"" tab and click on ""Ship Now"". A pop up will open where you need to select the checkbox for all the product(s) that need to be shipped. You can also update each product's quantity based on availability. Update your shipment package weight accordingly. Finally, click on the ""split and ship now"" button to proceed. You can then choose your preferred courier partner to ship your order. Once the pickup for partial shipment is scheduled according to courier selection then you will be redirected back to processing tab From ""Processing"" tab you can schedule pickup for remaining partial shipment Further assistance :- Is there service related anything else I can help you with ? Closing :- Thank you for calling Shiprocket. Have a nice day FD Ticket:- Seller User:- Seller's registered emai id Channel:- Customer Support Call Center Agent Assign :- Pratibha Ticket Priority :- Low Status :- Resolved Subject :- Split Shipment Query Body:- NA Private Notes :- NA Phone:- Calling number Source:- Phone / Chat Type:- Query FCR:- Yes Escalation Desk/ORM Tag :- NA VOC :- NA SR Issue Category:- Other Sub Category :- Other Issue Details :- NA Courier Name:- NA AWB Number :- NA Multiple AWB Number :- NA Multiple Case Scenario :- NA Shipment Status :- NA Jira Link :- NA KAM Action Flag :- NA"
NDR SOP POST NUGGET,https://sites.google.com/shiprocket.com/sop-shiprocket/ndr-sop-post-nugget,"NDR SOP POST NUGGET NDR SOP (NEW) Opening : Good Morning /Afternoon/ Evening Welcome to shiprocket. My Name is _. How may I help you? System Check :- 1) Copy link from SPARK & paste it in new tab / Click on Internal ICRM (Ask for AWB no. in shadowfax cases) 2) Click on View details > Click on NDR tab > Check NDR raised date & Undelivered reason 3) Check action taken by Seller/Buyer 4 ) Check NDR Communication if seller enables the Delivery Boost Service Seller Can take re-attemtp action via seller panel by below mentioned Path:- Path :- Login on seller panel > Place cursor on shipment tab > Click on process NDR > Search AWB > Check actions column > Click on Reattempt / RTO TAT will be 1-2 working days for further update after taking the BPR, as per nugget only. If BPR is pending case will assign to LOPS along with the BPR Pending tag. Buyer call post 8:30pm (NC) Kindly note no buyer's should be taken on call post 8:30pm and if seller insists below script to be used on call:- "" I understand your concern Sir/ma'am, however as per TRAI guidelines and our policy, buyer calls can’t be arranged post 8:30 PM to ensure privacy, but don't worry I've escalated your concern to the courier team lets wait for their response by (mention TAT) "" BPR steps:- TO DOs while taking BPR on call:- a) Verify buyer's name,product details b) Validate non-delivery (NDR) reason from buyer c) Confirm if FE contacted or reached for delivery attempt. Inform attempt date and time. d) Confirm if Buyer still ready to accept the "" packed shipment "" . ( deny in case future delivery is requested for more than 2 days delay/ open box delivery) e) Confirm alternate mobile number and landmark. f) Inform Buyer will receive a call from delivery reattempt g) BPR call control should be on Advisor's hand and ensure less interference from Seller on the BPR call. Actionables for NDR CB team 1. NDR CB team will try once to take BPR, incase of non-connectivity, NFCR to be raised to LOPS team with BPR pending tag in Nugget 2. If NDR CB team is unable to connect to Buyer and seller both, NFCR to be raised for delivery re-attempt. Inform the seller via email about non-contractibility and re-attempt request initiate. Further assistance :- Is there service related anything else I can help you with ? Closing :- Thank you for calling Shiprocket. Have a nice day Ticket Tagging:- Nugget Ticket for NFCR Cases (BPR Available) Seller User:- Seller's registered emai id Channel:- Lops NDR & RTO Agent Assign :- Auto Assign Ticket Priority :- Low Status :- Open Subject :- Reattempt Request RTO NDR Body:- NA Private Notes :- NA Phone:- Calling number Source:- Phone / Chat Type:- Query FCR:- NFCR Escalation Desk/ORM Tag :- NA VOC :- NA SR Issue Category:- Shipment NDR & RTO Sub Category :- Re-attempt Requested -RTO NDR Issue Details :- NA Courier Name:- NA AWB Number :- NA Multiple AWB Number :- NA Multiple Case Scenario :- NA Shipment Status :- NA Jira Link :- NA KAM Action Flag :- NA Nugget Ticket for NFCR Cases (BPR Pending) Seller User:- Seller's registered emai id Channel:- Lops NDR & RTO Agent Assign :- Auto Assign Ticket Priority :- Low Status :- Open Subject :- Reattempt Request RTO NDR Body:- NA Private Notes :- NA Phone:- Calling number Source:- Phone / Chat Type:- Query FCR:- NFCR Escalation Desk/ORM Tag :- NA VOC :- NA SR Issue Category:- Shipment NDR & RTO Sub Category :- Re-attempt Requested -RTO NDR Issue Details :- NA Courier Name:- NA AWB Number :- NA Multiple AWB Number :- NA Multiple Case Scenario :- NA Shipment Status :- NA Jira Link :- NA KAM Action Flag :- NA"
Mobile Application Paths,https://sites.google.com/shiprocket.com/sop-shiprocket/live/mobile-application-paths,"Back Application Paths Please refer the below Mobile Application paths to guide the seller regarding activation, deactivation, action, service request etc... NDR Escalation reattempt request path - Undelivered Shipment>>Tap to open Shipment Details Screen>>Get Help CTA(Click to Action)>>Non-Delivery Escalation Option>>Re-Attempt Option Pickup escalation request path - Pickup Scheduled Shipment>>Tap to open Shipment Details Screen>>Get Help CTA (Click to Action) >>Pickup Escalation Option>>Escalate Option Delivery escalation - Shipped' Shipment>>Tap to open Shipment Details Screen>>Get Help CTA (Click to Action) >>Delivery Delayed Escalation Option>>Escalate Option Hyperlocal - Click on 'Add Order' (Home) or '+' (Order listing)>>Select 'Hyperlocal Order' radio option>>Proceed Early COD activation and deactivation - Click on 'More' (Bottom Nav)>>Settings Option>>Remittance Option>>Early COD>>Accept T&C>>Activate Plan Plan upgrade and downgrade path - Click on 'More' (Bottom Nav)>>Upgrade Plan Option>>Activate Plan Weight dispute path - Click on 'More' (Bottom Nav)>>Weight Discrepencies Option>>Tap on relevant shipment>>Scroll to the bottom of Discripency Detail screen>>Accept/Reject Discripency Delivery boost - NA (From Panel only) Bank details update path - Click on 'More' (Bottom Nav)>>Settings Option>>Remittance Option>>Bank A/C Details Secure shipment path - Click on 'More' (Bottom Nav)>>Settings Option>>Features Option>>Scroll to the bottom>>Auto secure shipment toggle KYC update path - Click on 'More' (Bottom Nav)>>Settings Option>>KYC MPS in mobile app-order creation steps - NA (From Panel only) Postpaid activation and deactivation - Click on 'More' (Bottom Nav)>>Settings Option>>Features Option>>Scroll to the bottom>>'Opt for Postpaid Remittance' toggle COD to prepaid option - Click on 'Orders' (Bottom Nav)>>Search the order>>Tap to open Order Details Screen>>Scroll to the 'Order Details' section>>click edit icon for Payment Method>>Select the Payment Mode from dropdown Add a package image in order creation a path - Click on 'Orders' (Bottom Nav)>>Search the order>>Tap to open Order Details Screen>>Scroll to the bottom>>click on 'Add Package Images'>>Tap on the option for which the package image needs to be uploaded Delivery boost activation and deactivation - NA (From Panel only)"
Sales Related,https://sites.google.com/shiprocket.com/sop-shiprocket/sales-related,"Prospect Seller English :- “I am glad that you have shown interest to associate with shiprocket, let me give you brief about shiprocket. We are logistic aggregator and w e are currently working with 17+ courier partners across the country with 2 9 000+ pin code coverage USPs :- We have multiple plans available with us as per different r equirements of our sellers , al so we offer multiple services like:- Shiprocket fulfillment Shiprocket Cargo Shiprocket packaging International shipment & We have Channel Integration feature as well which will help you to fetch your other e-commerce orders on shiprocket p latform to pr ocess all the shipments at one place . Check if Seller is registered or not .. If not registered say - I am unable to find any details from the number you are calling , May I know if you have registered with us . If Yes - Check KYC and suggest to recharge wallet and start shipping If No :- Do not worry Sir/Ma'am, I will assist you with complete process. You can download shiprocket App from playstore or you can easily signup through desktop by just entering "" www.shiprocket.in "" Further I am arranging a call back from our expert, they will provide you complete assistance to opt for the best plan as per your business needs. Further i would like to confirm few details to arrange a callback for you:- Fill Pipe Drive Address - free text Product Category - select value Planned start date for shipments - select date Through which platform are you currently receiving orders? - Select value Any website to promote company? - free text Expected monthly shipments? - select valu e Do you also do international shipments? - select value Current shipping partner? - select value Source - Call center ** If the potential of the seller is less than 90 so open ticket will be assign to Karuna Gurung & Pipe Drive will not be filled. ** If the potential of the seller is more than 90 so fcr-resolved ticket will be assign to Suraj & Pipe Drive will be filled . Call Back Tat Will be 24 Hours English :- “I have arranged a callback for you from our experts & they will connect within 24 hours Closing :- Thank you for calling shiprocket have a nice day!! If the seller is already registered with the Shiprocket then the agent will ask for the exact query and educate about the same Query 1 – I want to upgrade my plan. Sir/mam, As I can see that you are already registered with the shiprocket , I would like to inform you that you can upgrade the plan from your seller panel (agent will brief about the plans) (If the seller asks more details about the plan and work ways of the shiprocket , the agent will use the below script) Sir/mam “ To suggest you the best plan, I would like to know few details from you regarding your business. (agents to fill the form).. Query 2 – Can I ship “x” product? Sir/mam, I would like to inform you that you can/cannot ship the “X” product . (agent will refer the Dangerous goods list provided to inform the seller if he can/cannot ship “X” product”. Query 3 – Why cannot I ship “X” product? Sir/mam , I would like to inform you that “X” product is not permissible from courier’s end Query 4. How many courier services are currently active with Shiprocket? Sir/mam I would like to inform you that We currently cater 17+ courier. Query 5. What is the cheapest plan for me as I do “X” number of shipments? To suggest you the best plan, I would like to know few details from you regarding your business. (agents to fill the form).. Power Lines . Shipping Rates :- Sir/Ma'am would like to inform you that shipping rates on shiprocket starts at very less amount which is Rs. 2 6.27/ 500 gms & further it depends upon distance & courier We do have rate calculator as well from where you can compare rates as per location selected & weight of shipment Plan Related :- Ship r ocket offers an attractive range of plans which will help you ship your shipments with ease NDR Facility :- Reduce undelivery with our automated NDR management solution Shiprocket captures non-delivery information in real time and updates you on the panel Real-time notification to the buyer via SMS and IVR to which buyer can responds Courier agent re-attempts shipments according to your & buyer remarks Packaging :- Smart Packaging Solutions for Your Business Offer your consumer a cost effective packaging experience with uniform quality — your one-stop shop for online packaging purchases/supplies Buy High Quality Corrugated Boxes and Flyers at The Lowest Prices Courier recommendation engine :- To make th e decision of selecting courier partner easy and error-free, we have created an intelligent tool which recommends the best courier partner for each of your shipments With CORE, you get four settings to select your preferred courier partner: Best Rated : Courier partners with the best ratings across all parameters for the selected source and destination pin code Cheapest : Courier partners with the lowest rates Fastest : Courier partners with the fastest delivery time Custom: You can also select your courier partners manually and make it your custom preference Integration :- Sell on the top channels and marketplaces while you ship with the most reliable shipping platform for eCommerce sellers With integration you can fetch your other e-commerce portal orders on shiprocket platform to prepare the same for shipping Tracking :- Stay updated with the status of your shipment Keep track of your orders and never miss an update again! The main objective of this parcel tracking system is to provide customers with information about the details of the route of the package, delivery status, estimated delivery date, and the estimated time of delivery Shipping with any of the courier partners You just need to enter your AWB number to get all tracking details Fulfillment :- Shiprocket Fulfillment has fulfillment centers across the country, making shipping within cities and within zones much faster. Fulfillment/warehousing service is now available in 14 cities which are Delhi, Gurugram, Jaipur, Lucknow, Ludhiana, Faridabad, Bangalore, Chennai, Hyderabad, Kolkata, Guwahati, Mumbai, Ahmedabad and Surat Reduce shipping costs drastically by decreasing distance between the customer’s residence and your warehouse Give your customers a premium e-commerce shipping experience with Shiprocket’s tech-enabled fulfillment cent er s No Storage Fee if Your Product Ships Within 30 Days Choose a fulfillment centre nearest to your customer and offer faster delivery Offer next-day delivery to your customers by choosing a fulfillment center closest to their residence With our fulfillment experts, experience seamless picking, shipping & hand over an absolute damage-free package to your customers English :- “I am forwarding your request to our sales experts and you will receive the call back from them within 24 hours Note :- For urgent call back, Tracker needs to fill (Shared on Email) Hindi :- Main Aapki request humare sales expert to transfer kar rahi hun aapko 24 ghante mein call back aa jayega. Closing :- Thank you for calling shiprocket have a nice day!!"
Shiprocket Exchange,https://sites.google.com/shiprocket.com/sop-shiprocket/home/shiprocket-exchange,"Exchange Enabled Seller Limited Launch: Shiprocket Exchange for SMB Sellers What is Shiprocket Exchange? Shiprocket Exchange (2-step Exchange) feature is a seamless exchange order management system for sellers. The focus is on driving the feature with a specific set of sellers using return service and sellers looking only for an exchange feature, and its adoption by educating sellers on the benefits, streamlining the process, and ensuring a smooth transition from returns to exchanges. Benefits Increase Revenue: Boost sales by offering exchanges, minimizing revenue loss & keeping customers engaged. Buyer Retention: A clear exchange policy on the website boosts Add to Cart & Checkout rates while increasing repeat purchases by 30%. Verified Returns: Boost trust with doorstep quality checks to validate returned items before processing exchanges. Less Manual Effort- Seamless Automated & workflows: Automate approvals of the buyer's exchange request on selected exchange reasons from the tracking page, and courier assignments to cut manual effort. Quick guide about the feature Exchange FAQs Document (Available on Co-Pilot) PFA SOP Couriers Handling Exchange Orders The Exchange order will be handled by the same courier partners currently serviceable. Think of it as a two-step process: The Exchange Return order will be picked up from the customer by the reverse courier partner, and The Exchange Forward order will be delivered to the customer by the forward courier partner. On Exchange Activation 1. Pop-Up on Seller Account We are showing this pop-up to sellers who have the Exchange feature enabled on their account, with a button to redirect them to the Settings Page. The settings page will help seller manage Exchange on required reasons of the buyer, automate exchange requests and courier assignment for Exchange return and Exchange forward both. 2. Change in Left Menu Tab and Returns Page How to Raise an Activation Request? We will be rolling it out in upcoming phases for another set of sellers. However, if any seller raises an activation request, please share the details through the Google Form . We will enable this feature on the same day. STANDARD PROCEDURE WITH TURN AROUND TIMES FOR EXCHANGE REPLACEMENT SHIPMENT (FORWARD) PRE-SHIP GUIDELINES ● At the time of adding an order, ensure entering and cross verifying buyer details, preferably add an alternate contact number and landmark to ensure smooth last mile delivery. Important - Payment mode and Address for different Pin code cannot be changed for In-transit shipment ● In case of future claims, it is important to enter correct product description and value of the product. ● Entering correct deadweight and dimensions measured after final packaging is important for calculation of current freight charges for your order. ● Important – Absence of correct buyer and product details or adequate transit worthy packaging may result in shipment being returned from origin with no refunds applicable. Tip - Use brand tape packaging to avoid theft/stolen issues. Pack your shipments in compact condition or in a manner so that volumetric weight does not get increased. Pickup generated at any given time during the day shall be scheduled for next day. In case of reverse pickup (returned from buyer), turnaround time (TAT) is 48 hours. ● Checklist for shipment handover: o Customer Invoice (to be kept inside packaging) o Label pasted on top of the parcel post packaging o Download &amp; print 2 copies of Manifest ● Proof of Pick Up - signed by the field executive mentioning the shipment count handed over, contact number &amp; date of pickup ● To be handed to field executive ● In case of return pickup, inform the buyer to collect acknowledgment slip as proof of pick up from the field executive. ● Quality check at the time of pickup will be done only if enabled on seller panel before creating order. ● Pickup not attempted within 24-hour time should be escalated via seller panel. Attempt on the escalation raised via panel shall be done within 48 hours of escalation. ● Shipment picked but not showing under Shipped status on the panel should be escalated within 72-Hour from pickup with signed manifest, count and pickup date. In case of return Shipments, acknowledgment slip will be required. POST-SHIP GUIDELINES 1) When raising an escalation on undelivered orders , use valid proofs like call recording with buyer or chat screenshot with buyer to escalate fake attempt via the panel directly. 2) In-Transit shipment for RTO is not a guaranteed service provided by the courier, so in this case inform your customer to not accept the parcel if delivery is attempted. 3) Post-Delivery disputes like Delivered status marked but not received can be raised via panel Requesting Proof of Delivery to confirm the details of the delivery. TAT for raising such requests is 72 hours from date of delivery. Upon request, POD will be uploaded within 10 working days. 4) POD Disputes, if any, need to be raised from panel within 48-Hours of receipt of POD. Resolution on such disputes will be shared on the panel itself within 10 working days. 5) Post-Delivery Dispute like Damaged/Wrong/Partial/Empty Parcel Received should be raised via ticket with below stated proofs: ● Images/videos of pre-Shipped final package and post-delivery shipment showing outer Packaging and inner content of the parcel. ● Unpacking video of the shipment received. Same should be made in case of suspicion. Important – Make sure to mention negative remarks on the POD at the time of accepting a shipment. No claim will be entertained in the absence of negative remarks. Important – In case of reverse shipments, Shiprocket will not be liable for wrong/missing product and same will need to be directly taken up with the buyer. FREIGHT REFUND POLICIES 1) If a shipment is marked Lost, actual order value or INR 2500 whichever is lower is automatically initiated in 3-4 working days. 2) Shipments with order value of more than Rs. 2500 need to be insured at seller end only. Please note that refund does not cover liquid/food items. 3) Shiprocket shall not be liable for the delivery of Banned, Restricted, Illegal, hazardous, or Prohibited items which are in breach of any applicable law. Product contents such as cash and Precious jewelry are also not allowed. 4) In case of delivery failure reasons like ODA (Out of Delivery Area) and OTP verified customer refusal to accept a shipment, no refund will be applicable. Important - Shipments which are undelivered due to ODA location will not show under NDR tab, so in this case ask you may also ask your customer to collect the parcel from the branch. You may get in touch with your key account manager for further information. STANDARD PROCEDURE WITH TURN AROUND TIMES FOR EXCHANGE RETURN PICKUP (REVERSE) Exchange SOP"
Bank Unfreeze,https://sites.google.com/shiprocket.com/sop-shiprocket/bank-unfreeze,Bank Unfreeze Opening : Good Morning/Afternoon/Evening Welcome to Shiprocket. My Name is _. How may I help you? System Check :- 1) Copy link from SPARK & paste it in new tab Inform seller about following :- Scenario:- If the seller wants to change the bank details Advisor will ask the reason from the seller to change the bank Details. Advisor will inform to the seller that name on Kyc & Bank details should be Same. If the Seller shared the reason & name will be same on kyc & bank details then case will assign to Compliance Query & share the TAT of 1-2 working days for the resolution. Inform seller to wait for details unfreeze and after unfreeze same could be updated from the seller panel. Further assistance :- Is there service related anything else I can help you with ? Closing :- Thank you for calling Shiprocket. Have a nice day. Nugget Tagging Seller User:- Seller's registered emai id Channel:- Compliance Query Agent Assign :- Ravi Jangra Ticket Priority :- Low Status :- Open Subject :- Change Bank Details Body:- NA Private Notes :- NA Phone:- Calling number Source:- Phone / Chat Type:- Query FCR:- NFCR Escalation Desk/ORM Tag :- NA VOC :- NA SR Issue Category:- Cod Remittance Sub Category :- Change Bank Details Issue Details :- NA Courier Name:- NA AWB Number :- NA Multiple AWB Number :- NA Multiple Case Scenario :- NA Shipment Status :- NA Jira Link :- NA KAM Action Flag :- NA
